title,url,gender,description,top_notes,middle_notes,base_notes,main_accords,gender_ratings,seasonal_ratings,price_ratings,image_url,scrape_duration_seconds,volume
Cosmic 2.0 Kylie Cosmetics,https://www.fragrantica.com/perfume/Kylie-Cosmetics/Cosmic-2-0-103467.html#cc2593354,for women,"Embody the essence of dawn with the second fragrance in the cosmic universe. cosmic kylie jenner 2.0, the floral amber sister to the original cosmic, envelops you in fresh, bright, and sweet notes grounded in a warm amber base. this captivating fragrance is housed in a chrome edition of our original sculptural bottle and is formed to fit perfectly in the palm of your hand.

Opening: pear accord and pink pepper essence Heart: vanilla orchid accord and lavender essence Base: amber accord and sandalwood accord","Pear, Pink Pepper","Vanilla Orchid, Lavender","Amber, Sandalwood","{""sweet"": 10.0, ""amber"": 8.6, ""floral"": 8.3, ""powdery"": 8.3, ""fruity"": 8.0, ""woody"": 7.7, ""lavender"": 6.6, ""soft spicy"": 6.0, ""aquatic"": 5.7, ""fresh"": 5.0}","{""female"": 101, ""more_female"": 36, ""unisex"": 10, ""more_male"": 0, ""male"": 3}","{""winter"": 34.43, ""spring"": 100.0, ""summer"": 63.11, ""fall"": 59.84, ""day"": 88.52, ""night"": 35.25}","{""way overpriced"": 8, ""overpriced"": 7, ""ok"": 48, ""good value"": 57, ""great value"": 13}",https://fimgs.net/mdimg/perfume/375x500.103467.jpg,34.09,100
Crystal Noir Versace,https://www.fragrantica.com/perfume/Versace/Crystal-Noir-631.html,for women,"According to Donatella Versace, Crystal Noir is a rare essence, sensual and delicate. The central note of the composition is mysterious gardenia, fresh, sensual, luminous and creamy, reproduced by 'headspace' technology. Oriental and musk in the base make the scent dark and mysterious, very sensual and distinct. The fragrance was created by Antoine Lie in 2004.","Pepper, Ginger, Cardamom","Coconut, Gardenia, Orange Blossom, Peony","Sandalwood, Musk, Amber","{""fresh spicy"": 10.0, ""warm spicy"": 9.3, ""white floral"": 9.1, ""coconut"": 8.4, ""lactonic"": 6.7, ""woody"": 6.2, ""powdery"": 6.2, ""sweet"": 5.9, ""fresh"": 5.9, ""musky"": 5.4}","{""female"": 3728, ""more_female"": 1251, ""unisex"": 577, ""more_male"": 51, ""male"": 27}","{""winter"": 86.18, ""spring"": 29.69, ""summer"": 26.15, ""fall"": 76.73, ""day"": 39.48, ""night"": 100.0}","{""way overpriced"": 146, ""overpriced"": 599, ""ok"": 2622, ""good value"": 1346, ""great value"": 339}",https://fimgs.net/mdimg/perfume/375x500.631.jpg,33.64,50
Daisy Marc Jacobs,https://www.fragrantica.com/perfume/Marc-Jacobs/Daisy-1361.html,for women,"Daisy is a sparkly floral-woody fragrance, fresh and feminine at the same time. It is devoted to a sophisticated, seductive, and dazzling woman, which at the same time strives to simplicity. It is captured in a lovely bottle decorated with daisy flowers on the top. Creator of this fragrance is Alberto Morillas.

Charming Daisy fragrance caresses with the fruity strawberry notes, intensive green aroma of violet leaf and sparkling spicy pink grapefruit. Its heart beats in floral rhythm, composed of silky and intoxicating gardenia, delicate violet, and jasmine petals. The powdery soft dry down is composed of white woods, vanilla and musk.

Daisy comes as Eau de Toilette in 50m and 100ml bottles, and is accompanied by shower gel, body lotion and body butter.","Violet Leaf, Blood Grapefruit, Strawberry","Violet, Gardenia, Jasmine","Musk, White Woods, Vanilla","{""white floral"": 10.0, ""ozonic"": 9.7, ""powdery"": 8.4, ""violet"": 8.1, ""citrus"": 8.0, ""aquatic"": 7.9, ""fruity"": 6.9, ""sweet"": 6.3, ""woody"": 6.0, ""musky"": 5.9}","{""female"": 2152, ""more_female"": 299, ""unisex"": 75, ""more_male"": 6, ""male"": 2}","{""winter"": 9.55, ""spring"": 91.14, ""summer"": 71.38, ""fall"": 17.55, ""day"": 100.0, ""night"": 11.15}","{""way overpriced"": 113, ""overpriced"": 462, ""ok"": 1144, ""good value"": 455, ""great value"": 61}",https://fimgs.net/mdimg/perfume-thumbs/375x500.1361.jpg,41.29,50
Delina Exclusif Parfums de Marly,https://www.fragrantica.com/perfume/Parfums-de-Marly/Delina-Exclusif-50370.html,for women,"""Delina Exclusif is the full quintessence of Delina. Some will detect a suede-gloved, slightly milky rose; others a floral bouquet good enough to eat with scattered delicious hints of peach, apricot and lychee. After an opening of bergamot/pear/lychee, the Turkish rose takes on a veiling of incense and suggestions of burning oud before nestling into a soft bed of woody, amber and vanilla notes. All the mystery of the orient is here, in this luxurious concentration of seduction that carries a powerful sensual charge."" - a note from the brand.","Litchi, Pear, Bergamot, Grapefruit, Pink Pepper","Turkish Rose, Agarwood (Oud), Incense","Vanilla, Amber, Musk, Vetiver, Evernyl","{""rose"": 10.0, ""fruity"": 8.6, ""vanilla"": 8.1, ""amber"": 7.4, ""tropical"": 6.0, ""fresh"": 5.9, ""sweet"": 5.5, ""woody"": 5.4, ""oud"": 5.3, ""floral"": 5.3}","{""female"": 2503, ""more_female"": 250, ""unisex"": 98, ""more_male"": 13, ""male"": 24}","{""winter"": 90.91, ""spring"": 100.0, ""summer"": 56.5, ""fall"": 94.54, ""day"": 97.25, ""night"": 88.74}","{""way overpriced"": 987, ""overpriced"": 980, ""ok"": 666, ""good value"": 138, ""great value"": 74}",https://fimgs.net/mdimg/perfume/375x500.50370.jpg,38.0,100
Devotion Dolce&Gabbana,https://www.fragrantica.com/perfume/Dolce-Gabbana/Devotion-84951.html,for women,"Devotion  is a celebration of the irresistible Italian dessert, panettone, and its delectable aromas. With top notes of candied lemon, a heart of orange blossom, and a base of vanilla, it's an enchanting gourmand blend, said Olivier Cresp.",Candied Lemon,"Panacotta, Orange Blossom, Rum",Vanilla,"{""vanilla"": 10.0, ""sweet"": 9.1, ""white floral"": 6.5, ""lactonic"": 5.1, ""powdery"": 5.1, ""rum"": 5.0, ""citrus"": 4.7}","{""female"": 3433, ""more_female"": 748, ""unisex"": 296, ""more_male"": 21, ""male"": 24}","{""winter"": 94.29, ""spring"": 70.64, ""summer"": 50.69, ""fall"": 100.0, ""day"": 96.2, ""night"": 62.5}","{""way overpriced"": 327, ""overpriced"": 1151, ""ok"": 2071, ""good value"": 541, ""great value"": 95}",https://fimgs.net/mdimg/perfume/375x500.84951.jpg,36.43,100
Devotion Intense Dolce&Gabbana,https://www.fragrantica.com/perfume/Dolce-Gabbana/Devotion-Intense-96028.html,for women,"Devotion Eau de Parfum Intense is a delicious fragrance that celebrates the noblest values of life, a unique essence sealed with the Sacred Heart. Top notes: hazelnut Middle notes: orange blossom Base notes: vanilla

DOLCE & GABBANA DEVOTION INTENSE EAU DE PARFUM is available as a 30ml, 50ml and 100ml Eau de Parfum Intense.",Hazelnut,Orange Blossom,Vanilla,"{""vanilla"": 10.0, ""nutty"": 9.1, ""white floral"": 8.4, ""sweet"": 7.2, ""woody"": 6.6, ""citrus"": 5.7, ""powdery"": 5.1}","{""female"": 546, ""more_female"": 158, ""unisex"": 73, ""more_male"": 0, ""male"": 11}","{""winter"": 100.0, ""spring"": 45.13, ""summer"": 26.43, ""fall"": 95.98, ""day"": 76.04, ""night"": 74.81}","{""way overpriced"": 58, ""overpriced"": 183, ""ok"": 380, ""good value"": 79, ""great value"": 15}",https://fimgs.net/mdimg/perfume/375x500.96028.jpg,38.92,50
Dior Homme 2020 Dior,https://www.fragrantica.com/perfume/Dior/Dior-Homme-2020-58714.html,for men,"Dior Homme, a powdery iris and woody scent for men, was introduced in the original version in 2005 and then later came the new 2011 version. The 2020 version of Dior Homme Eau de Toilette is announced with the slogan ""I'm Your Man."" The 2011 edition remains on the shelves under the name, Dior Homme Original.

The new Dior Homme is created by Dior in-house perfumer Francois Demachy who wanted to redefine masculine sensuality. The fragrance is intensely woody, warm, and sensual. A virile accord of Atlas cedar and the warmth of cashmere wood are pampered with spicy aromas.

""This new Dior Homme has an unmistakably virile signature that does not prevent it from developing tender, sensual accents. It basically draws the portrait of a modern man."" François Demachy, Dior Perfumer-Creator

According to the perfumer, this is a fragrance overdosed with carnal woody notes, and it represents a return to the basics: classic and simplicity. It is clear, clean, gentle, and woody but also slightly sweet, and wears like a second skin.

The new bottle follows the architectural design of its predecessors, with a more prominent logo and perfume name on the plug. The face of the advertising campaign remains actor Robert Pattinson.

Dior Homme is available as a 50 and 100 ml Eau de Toilette with the accompanying grooming line, now available in new packaging.","Bergamot, Pink Pepper, elemi","Atlas Cedar, Cashmere Wood, Patchouli","Iso E Super, Haitian Vetiver, White Musk","{""woody"": 10.0, ""musky"": 7.3, ""aromatic"": 5.4, ""amber"": 5.2, ""citrus"": 4.7, ""powdery"": 4.4}","{""female"": 48, ""more_female"": 9, ""unisex"": 243, ""more_male"": 1006, ""male"": 3362}","{""winter"": 73.23, ""spring"": 100.0, ""summer"": 82.54, ""fall"": 99.29, ""day"": 97.45, ""night"": 78.8}","{""way overpriced"": 198, ""overpriced"": 834, ""ok"": 2555, ""good value"": 656, ""great value"": 101}",https://fimgs.net/mdimg/perfume/375x500.58714.jpg,35.47,100
Dior Homme Intense 2025 Dior,https://www.fragrantica.com/perfume/Dior/Dior-Homme-Intense-2025-101596.html#cc2606357,for men,"Dior Homme Intense 2025 Eau de Parfum has been repackaged, maintaining its original formula. This fragrance exudes grandeur and sophistication, showcasing iris enriched with a captivating amber accent and a sumptuous woody base, leaving a sensual and enduring trail.",Tuscan Iris,Ambrette,Virginia Cedar,"{""iris"": 10.0, ""musky"": 8.5, ""floral"": 7.8, ""powdery"": 7.8, ""woody"": 7.2, ""violet"": 6.5, ""earthy"": 5.8, ""aromatic"": 4.7}","{""female"": 39, ""more_female"": 6, ""unisex"": 51, ""more_male"": 76, ""male"": 75}","{""winter"": 100.0, ""spring"": 61.29, ""summer"": 32.26, ""fall"": 94.84, ""day"": 69.03, ""night"": 93.55}","{""way overpriced"": 67, ""overpriced"": 35, ""ok"": 103, ""good value"": 22, ""great value"": 5}",https://fimgs.net/mdimg/perfume-thumbs/375x500.101596.jpg,38.75,100
Dior Homme Parfum Dior,https://www.fragrantica.com/perfume/Dior/Dior-Homme-Parfum-27417.html,for men,"The new version will introduce the very essence of Dior Homme, in an unusual concentration which leaves an urban and intense impression. The nobility of its ingredients is expressed by the uniqueness of the skin.

DIOR HOMME PARFUM contains three key notes of the composition printed on its bottle: Iris from Tuscany, sandalwood from Sri Lanka and dark and masculine leather accord. The fragrance is available in a distinctive glass bottle of 75 ml at a price of 102.50 Euros. The outer packaging is black with discreet detailing in gold color.","Tuscan Iris, Italian Orange","Leather, Rose","Sandalwood, Ambrette (Musk Mallow), Agarwood (Oud), Cedar","{""iris"": 10.0, ""woody"": 9.5, ""leather"": 9.3, ""powdery"": 9.2, ""violet"": 6.5, ""floral"": 6.2, ""animalic"": 6.1, ""earthy"": 5.8, ""oud"": 5.4, ""rose"": 5.4}","{""female"": 87, ""more_female"": 38, ""unisex"": 678, ""more_male"": 1483, ""male"": 2278}","{""winter"": 100.0, ""spring"": 29.17, ""summer"": 10.71, ""fall"": 85.57, ""day"": 34.64, ""night"": 90.4}","{""way overpriced"": 276, ""overpriced"": 896, ""ok"": 2104, ""good value"": 634, ""great value"": 274}",https://fimgs.net/mdimg/perfume/375x500.27417.jpg,35.91,200
Dior Homme Sport 2021 Dior,https://www.fragrantica.com/perfume/Dior/Dior-Homme-Sport-2021-71326.html,for men,"The new Dior Homme Sport Eau de Toilette plays with themes of freshness and sensuality. The fragrance was announced as radiant, enriched with a new, lasting impression.

Energetic and elegant, the new Dior Homme Sport combines the luminescence of citrus and spice notes with a sensual touch of woods and amber that pack ""the punch of a boxer's uppercut"". The composition is immediately recognizable in the opening, marked by its lemony freshness. For the new fragrance, Francois Demachy chose to wrap the freshness up in spices and round it off with woody notes and frankincense.Frankincense is added for the first time to the heart of Dior Homme Sport.

""I reworked the signature freshness of Dior Homme Sport to pack the punch of a boxer's uppercut. [...] It's a decidedly new composition, revisited with a notion of carefree elegance."" - François Demachy.

The clear glass of the bottle is chiseled with sleek lines and topped with the line's signature cap, a black cube with the DIOR HOMME logo. Below, the letters SPORT stand out in a vibrant vinyl red.

The fragrance is available as a 70 and 120 ml Eau de Toilette.","Lemon, Bergamot, Aldehydes","elemi, Pink Pepper","Olibanum, Amber","{""citrus"": 10.0, ""aromatic"": 7.0, ""woody"": 6.2, ""fresh spicy"": 5.7, ""amber"": 5.5, ""aldehydic"": 5.2, ""fresh"": 5.0, ""soft spicy"": 4.4}","{""female"": 24, ""more_female"": 5, ""unisex"": 148, ""more_male"": 741, ""male"": 2352}","{""winter"": 21.23, ""spring"": 95.34, ""summer"": 100.0, ""fall"": 65.24, ""day"": 95.95, ""night"": 38.41}","{""way overpriced"": 121, ""overpriced"": 572, ""ok"": 1809, ""good value"": 460, ""great value"": 76}",https://fimgs.net/mdimg/perfume-thumbs/375x500.71326.jpg,35.31,100
DKNY Be Delicious Donna Karan,https://www.fragrantica.com/perfume/Donna-Karan/DKNY-Be-Delicious-498.html,for women,"This is a bright, fresh and energetic fragrance, which matches a picture of a bold, but charming woman. The top features green notes, violet leaf, apple, grapefruit and magnolia. The heart brings tuberose, lily of the valley, rose and violet, while the base – sandalwood, amber and musk.","Cucumber, Grapefruit, Magnolia","Green Apple, Lily-of-the-Valley, Tuberose, Violet, Rose","Sandalwood, Amber","{""green"": 10.0, ""fruity"": 9.7, ""aquatic"": 9.4, ""ozonic"": 9.2, ""fresh"": 8.5, ""citrus"": 6.6, ""white floral"": 5.7, ""floral"": 5.4, ""fresh spicy"": 5.1, ""woody"": 4.6}","{""female"": 1860, ""more_female"": 745, ""unisex"": 378, ""more_male"": 9, ""male"": 4}","{""winter"": 8.96, ""spring"": 78.79, ""summer"": 88.55, ""fall"": 17.04, ""day"": 100.0, ""night"": 9.51}","{""way overpriced"": 57, ""overpriced"": 260, ""ok"": 1224, ""good value"": 865, ""great value"": 205}",https://fimgs.net/mdimg/perfume-thumbs/375x500.498.jpg,34.23,200
Eau d'Ombré Leather Tom Ford,https://www.fragrantica.com/perfume/Tom-Ford/Eau-d-Ombre-Leather-95389.html,for men,"Eau d'Ombré Leather is described as a wildly radiant composition with leather notes made smoother and milder, mixing accords of rich amber, vanilla, glowing leather, and refreshing spices. The composition opens boldly with fresh ginger, coriander, and cardamom. The note of vanilla tincture stokes a glowing leather accord, a sensual flame grounded in a landscape of rich amber and honeyed woods.

Eau d’Ombré Leather is packaged in a translucent black bottle with a faux-leather plaque. It is available in quantities of 10ml, 50ml, and 100ml.","Cardamom, Ginger, Coriander","Vanilla, Leather",Ambrofix™,"{""vanilla"": 10.0, ""leather"": 8.9, ""warm spicy"": 7.3, ""aromatic"": 6.2, ""animalic"": 6.0, ""powdery"": 5.1, ""smoky"": 4.8, ""fresh spicy"": 4.7, ""soft spicy"": 4.6, ""sweet"": 4.5}","{""female"": 22, ""more_female"": 26, ""unisex"": 328, ""more_male"": 371, ""male"": 266}","{""winter"": 100.0, ""spring"": 58.83, ""summer"": 16.4, ""fall"": 95.18, ""day"": 59.63, ""night"": 90.48}","{""way overpriced"": 115, ""overpriced"": 241, ""ok"": 415, ""good value"": 104, ""great value"": 21}",https://fimgs.net/mdimg/perfume-thumbs/375x500.95389.jpg,38.16,50
Eilish Billie Eilish,https://www.fragrantica.com/perfume/Billie-Eilish/Eilish-70052.html,for women,Eilish is a vanilla-based fragrance.,"Sugar, Red Berries, Mandarin Orange","Vanilla, Cacao, Rose","Tonka Bean, Amber, Musk","{""vanilla"": 10.0, ""sweet"": 8.5, ""warm spicy"": 6.3, ""cacao"": 5.6, ""amber"": 5.2, ""powdery"": 5.2}","{""female"": 2827, ""more_female"": 1636, ""unisex"": 642, ""more_male"": 20, ""male"": 19}","{""winter"": 96.92, ""spring"": 28.74, ""summer"": 20.44, ""fall"": 100.0, ""day"": 65.9, ""night"": 77.26}","{""way overpriced"": 121, ""overpriced"": 391, ""ok"": 1702, ""good value"": 2174, ""great value"": 485}",https://fimgs.net/mdimg/perfume/375x500.70052.jpg,36.2,50
Emporio Armani Stronger With You Giorgio Armani,https://www.fragrantica.com/perfume/Giorgio-Armani/Emporio-Armani-Stronger-With-You-45258.html,for men,"Armani announces a new fragrant pair and a new pillar of the Emporio Armani line which is supposed to represent ""an olfactive embodiment of authentic modern-day love."" The feminine edition Because It's You and the masculine Stronger With You come out in June 2017.

Top notes: cardamom, pink pepper, violet leaves. Heart: sage. Base: crystallized chestnut, Vanilla Jungle Essence, Orientalwood.

Stronger With You comes in quantities of a 30, 50 and 100 ml Eau de Toilette.","Chestnut, Sugar","Sage, Lavender","Vanilla, Smoke","{""vanilla"": 10.0, ""sweet"": 5.8, ""balsamic"": 5.7, ""nutty"": 5.4, ""aromatic"": 5.2, ""powdery"": 4.9, ""lavender"": 4.7, ""herbal"": 4.6, ""soft spicy"": 4.6, ""warm spicy"": 4.5}","{""female"": 52, ""more_female"": 37, ""unisex"": 673, ""more_male"": 2207, ""male"": 2207}","{""winter"": 100.0, ""spring"": 32.92, ""summer"": 11.99, ""fall"": 92.32, ""day"": 50.64, ""night"": 88.1}","{""way overpriced"": 81, ""overpriced"": 484, ""ok"": 2490, ""good value"": 1414, ""great value"": 259}",https://fimgs.net/mdimg/perfume/375x500.45258.jpg,35.71,200
Emporio Armani Stronger With You Intensely Giorgio Armani,https://www.fragrantica.com/perfume/Giorgio-Armani/Emporio-Armani-Stronger-With-You-Intensely-52802.html,for men,"Emporio Armani Stronger With You Intensely is an oriental-woody fragrance with fougere accents. It tells a story of the excitement of a new and young love. Top notes include spices and violet, with the heart that combines lavender with sweet toffee caramel and cinnamon. The base ends with suede, vanilla and amber.

Emporio Armani Stronger With You Intensely is available as a 30, 50 and 100 ml Eau de Parfum.","Pink Pepper, Juniper, Violet","Toffee, Cinnamon, Lavender, Sage","Vanilla, Amber, Tonka Bean, Suede","{""vanilla"": 10.0, ""sweet"": 9.3, ""amber"": 7.2, ""cinnamon"": 6.9, ""warm spicy"": 6.7, ""powdery"": 5.9, ""aromatic"": 5.7, ""soft spicy"": 5.4, ""caramel"": 4.9}","{""female"": 103, ""more_female"": 76, ""unisex"": 1717, ""more_male"": 5407, ""male"": 4826}","{""winter"": 100.0, ""spring"": 17.64, ""summer"": 8.57, ""fall"": 80.42, ""day"": 37.05, ""night"": 81.09}","{""way overpriced"": 188, ""overpriced"": 1084, ""ok"": 6042, ""good value"": 3480, ""great value"": 673}",https://fimgs.net/mdimg/perfume/375x500.52802.jpg,34.19,50
Encre Noire A L'Extreme Lalique,https://www.fragrantica.com/perfume/Lalique/Encre-Noire-A-L-Extreme-32356.html,for men,"As the new successor to fragrance Encre Noire by Lalique presented in 2006, the market welcomes ENCRE NOIRE A L'Extreme, an intense masculine edition available since October 2015. With its design, the new edition reminds us of the famous ""Encrier"" designed by Rene Lalique in 1913, which served for design of the first fragrance Encre Noir and its successors Encre Noire Pour Elle in 2009 and Encre Noire Sport in 2013. The latest edition after moving towards a lighter interpretation and ‘sporty’ version of the original, the accent is now placed on intensive woodsy blend of cypress and vetiver.

Composition of the new fragrance ENCRE NOIRE A L'EXTREME is announced as very masculine, intensive, powerful. ""Bergamot, cypress, incense, vetiver (Java & Haiti), sandalwood, patchouli ENCRE NOIRE À L’EXTRÊME redefines masculine sensuality with a powerful blend of cypress and vetiver. A new woody intensity, for a unique, unforgettable trail…""

The fragrance is available as 50 and 100ml Eau de Parfum.","Cypress, Elemi resin, Bergamot","Haitian Vetiver, Vetiver, Incense, Orris","Benzoin, Sandalwood, Patchouli","{""woody"": 10.0, ""aromatic"": 8.6, ""amber"": 6.8, ""balsamic"": 6.1, ""warm spicy"": 5.9, ""earthy"": 5.8, ""smoky"": 5.2, ""fresh spicy"": 4.6}","{""female"": 37, ""more_female"": 11, ""unisex"": 343, ""more_male"": 789, ""male"": 2558}","{""winter"": 98.84, ""spring"": 45.37, ""summer"": 13.75, ""fall"": 100.0, ""day"": 55.97, ""night"": 89.81}","{""way overpriced"": 54, ""overpriced"": 66, ""ok"": 424, ""good value"": 1039, ""great value"": 1983}",https://fimgs.net/mdimg/perfume-thumbs/375x500.32356.jpg,40.68,50
English Pear & Freesia Jo Malone London,https://www.fragrantica.com/perfume/Jo-Malone-London/English-Pear-Freesia-10314.html,for women,"Jo Malone presents new fragrance, English Pear and Freesia, which unites English landscapes and seasons which are connected with souls of the British.

Inspiration for this fragrance were also verses by one of the last great romantic poets, John Keats (Ode to Autumn).

Jo Malone's creative studio chose a perfumer for this collection. That is Christine Nagel known for numerous successful creations (Miss Dior Cherie, Narciso Rodriguez, Rose Absolue, Delices etc). The fragrance is ripe, juicy and thoroughly designed.

Nuances of freesia and pear are very complex, since ripe pears were necessary to achieve a certain note to sound unique in composition of the fragrance.

Pear in the moment of perfect ripeness has crispy structure of skin and juicy fruit. Pear is combined with quince which introduces honey sweetness and is surrounded with white freesia and wild climbing rose.

A base of the composition is created of green, fresh and sour nuances of rhubarb along with warm and subtle aromas of patchouli, amber and white musk that stay in a trail.

Jo Malone English Pear and Freesia is available as 30 and 100ml EDC. The fragrance arrives on the market in September 2010.","Pear, Melon","Freesia, Rose","Musk, Patchouli, Rhuburb, Amber","{""floral"": 10.0, ""fruity"": 8.8, ""rose"": 7.0, ""sweet"": 7.0, ""aquatic"": 6.3, ""musky"": 5.9, ""fresh"": 5.4, ""patchouli"": 5.3, ""green"": 5.0, ""powdery"": 4.6}","{""female"": 1676, ""more_female"": 815, ""unisex"": 453, ""more_male"": 9, ""male"": 12}","{""winter"": 17.5, ""spring"": 99.9, ""summer"": 75.8, ""fall"": 38.83, ""day"": 100.0, ""night"": 18.36}","{""way overpriced"": 386, ""overpriced"": 1034, ""ok"": 950, ""good value"": 177, ""great value"": 28}",https://fimgs.net/mdimg/perfume/375x500.10314.jpg,35.0,50
Erba Gold Xerjoff,https://www.fragrantica.com/perfume/Xerjoff/Erba-Gold-76683.html,unisex,"Erba Gold opens to citrusy top notes of lemon from Amalfi, Brazilian orange and ginger, specked with a spicy heart of cardamom from Guatemala and cinnamon which makes way for an enticingly warm base of white musk , amber and Madagascan vanilla.

Erba Gold is presented with a unique silk neck scarf designed by Xerjoff and produced by famous silk manufacturers in Lake Como .

Amalfi Lemon, Calabrian Bergamot , Brazilian Orange, Ginger

Green Apple , Melon, Pear, Cloves, Guatemalan Cardamom , Madagascar Cinnamon

Musk, Oriental , Madagascan Vanilla , Woody Notes","Brazilian Orange, Sicilian Lemon, Calabrian bergamot, Ginger","Melon, Pear, Green Apple, Cinnamon, Guatemalan Cardamom, Cloves","White Musk, Madagascar Vanilla, Amber","{""citrus"": 10.0, ""fruity"": 8.1, ""fresh"": 7.4, ""sweet"": 6.8, ""aquatic"": 6.5, ""fresh spicy"": 5.9, ""warm spicy"": 5.8, ""musky"": 5.6, ""ozonic"": 5.6, ""powdery"": 5.5}","{""female"": 106, ""more_female"": 165, ""unisex"": 707, ""more_male"": 196, ""male"": 53}","{""winter"": 18.58, ""spring"": 87.52, ""summer"": 100.0, ""fall"": 41.22, ""day"": 86.32, ""night"": 40.67}","{""way overpriced"": 173, ""overpriced"": 479, ""ok"": 344, ""good value"": 65, ""great value"": 21}",https://fimgs.net/mdimg/perfume/375x500.76683.jpg,37.29,50
Eros Energy Versace,https://www.fragrantica.com/perfume/Versace/Eros-Energy-92647.html,for men,"Eros Energy is inspired by the breathtaking beauty of the Mediterranean coastline; the freshness of its scenery, the wildness of the air, and the luxury of a vast Italian vacation.

Channing Tatum stars in the Versace Eros campaign that debuts the collection’s latest eau de parfum pour homme, Eros Energy, and joins the existing Eros and Eros Flame fragrances.

Love, passion, desire and the breathtaking beauty of the Mediterranean shores form the inspirations of this olfactory creation. A unique freshness and sensuality to feel powerful, sexy and positive. Versace Eros Energy is the fragrance of a passionate man, master of himself and the codes of masculine allure.

Top notes: bergamot, blood orange, lime, mandarin, grapefruit, Lemon Heart notes: white amber, blackcurrant, pink pepper Base notes: patchouli, musk, oakmoss Available as 50ml and 100ml Eau de Parfum.","Lemon, Lime, Grapefruit, Blood Orange, Sicilian Bergamot, Mandarin Orange","White Amber, Pink Pepper, Black Currant","Oakmoss, Musk, Patchouli","{""citrus"": 10.0}","{""female"": 48, ""more_female"": 14, ""unisex"": 327, ""more_male"": 708, ""male"": 869}","{""winter"": 11.42, ""spring"": 75.73, ""summer"": 100.0, ""fall"": 25.33, ""day"": 85.83, ""night"": 21.21}","{""way overpriced"": 160, ""overpriced"": 342, ""ok"": 884, ""good value"": 343, ""great value"": 68}",https://fimgs.net/mdimg/perfume/375x500.92647.jpg,34.85,50
